video_id,title,description,published_at,channel,category_id,tags,view_count,like_count,comment_count
AIu83Llt858,Why is dry ice so dangerous? | #aumsum #kids #science #education #children,Buy AumSum Merchandise: http://bit.ly/3srNDiG Website: https://www.aumsum.com Dry ice is basically solid carbon dioxide.,2018-05-10T04:43:00Z,It's AumSum Time,27,"['smart learning', 'smart learning for all', 'smartlearning', 'animation', 'teacher', 'student', 'school', 'lesson', 'education', 'science', 'Secondary School (School Category)', 'Chemistry', 'dry ice', 'Why is dry ice so dangerous', 'ice', 'dry', 'why is dry ice hot', 'why is dry ice used in ice cream carts', 'why is dry ice so cold', 'why is dry ice bad', 'why is dry ice used in grignard reaction', 'why is dry ice so hard to find', 'aum', 'aumsum', 'aum sum', ""it's aumsum time""]",3976353,19572,0
5lk8IRDsnOs,Luca(faster) #superclever #abacus #franchise #math #school #mentalarithmetic #education #abacusmath,,2024-01-10T12:03:11Z,Superclever,22,[],72455720,1632479,5293
3axfnC6fnDM,Les matières en français 🇫🇷 #apprendre #enfants #débutant #education #maternelle,,2025-05-13T12:32:34Z,Kidi Fun,10,[],10475129,75565,0
BHmFMalHC3o,Education is No Longer for Everyone,Click Here To Get Books: https://linktr.ee/rakeshyadavbook आप WhatsApp Channel पर भी जुड़ सकते है (Free ...,2025-07-19T09:16:38Z,Rakesh Yadav,27,[],3489180,268752,8969
_BHjXykHhYU,Kindergarten Sight Words: Yes | ABCmouse #learning #education #sightwordsforkids #kindergarten,Visit https://ABCmouse.com/LearnMore to find out more about our award-winning online learning program for children 2–8!,2025-03-20T13:00:52Z,ABCmouse.com Early Learning Academy,27,"['abcmouse.com', 'abcmouse', 'abc', 'mouse', 'abc mouse', 'kids', 'learning', 'games', 'preschool', 'prek', 'kindergarten', 'TV', 'school', 'teacher', 'headstart', ""ABC's"", 'early academy', 'childhood', 'education', 'family', 'parents', 'online', 'ESL', 'reading', 'math', 'phonics', 'music', 'art', 'books', 'songs', 'puzzles', 'printables', 'mathematics', 'numbers', 'shapes', 'curriculum', 'children', 'phonemic', 'vocabulary']",325681664,1246404,0
uEKBEu1sVzk,Les formes en français 3 🇫🇷 #apprendre #enfants #débutant #education #maternelle #géométrie,,2025-07-27T21:22:12Z,Kidi Fun,10,[],7146983,53461,0
3xGhj-bLLDo,Anyme donne son avis sur l&#39;éducation #anyme #education #edit,Anyme donne son avis sur l'éducation #anyme #education #edit.,2025-08-04T14:56:50Z,LaMinuteAnyme,24,[],1641554,71869,1141
mSC1GzBtAmA,Essay on &quot;Importance of Education&quot; in English/Paragraph of Importance of Education@alearningpoint,How can I write English essay on education Essay on education Best English essay on education Education essay Write simple ...,2023-04-25T14:14:14Z,A Learning Point,27,"['a learning point', 'essay on education', 'education essay in English', 'study karo', 'essay on importance of education', 'paragraph of importance of education', 'paragraph on education', 'importance of educaation', 'how to write an importance of education', 'RS study', 'saz education', 'how to write an education essay', 'importance of education speech in English', 'importance of education speech', 'important of education speech']",1474177,29513,628
psts3bazB1M,Easy Poem on Education in English | Poem on Education for Students | #poemoneducation,"poemoneducation #easypoem hindi kavita,motivational poem,hindi poem,poem on education,english poem on education,poem ...",2024-02-10T07:30:13Z,Talk With Shivi,27,"['hindi kavita', 'motivational poem', 'hindi poem', 'poem on education', 'english poem on education', 'poem for students', 'easy poem on education', 'poem on education in hindi', 'hindi kavitayen', 'hindi kavita for kids', 'hindi kavita bacchon ke liye', 'hindi kavita for hindi diwas', 'poetry in hindi', 'poem in hindi', 'poem for students on inspiration', 'poem for students in english', 'Poem on education in english', 'education poem for stuents', 'education poem']",330172,3089,62
sZI1PHFY-20,Learn from China#chinese #education #facts @manojsir,,2025-06-20T13:17:34Z,bodhi tree,27,[],6843114,142923,2081
cI_sL3qRlnY,Learn with fun 🤗#activity #youtubeshorts #education #school,,2025-02-11T11:23:53Z,Brijendra Mishra,24,[],7805318,50515,19
4XaVutevq3o,Why China&#39;s education system is better than India&#39;s | Khan Sir | IND Education System 📉 #shorts,rajshamani #education #indian #chinaeducation #indianeducation #khansir #politics.,2025-04-19T03:38:31Z,ALL IN ONE,22,[],227710,0,60
TSOPQUOyMdM,The &quot;Dark Side&quot; of Education System😢| Rv Jarwal                #upsc #ias #ips #lbsnaa #education,ips #ias #ifs #upsc #lbsnaa #lbsnaaMotivation #upscmotivation #iasmotivation #ipsmotivation #ifsmotivation ...,2025-02-21T14:05:00Z,Rv Jarwal,27,"['IIT motivation', 'UPSC motivational video', 'motivational video', 'IAS status', 'UPSC', 'RV Jarwal', 'IAS entry', 'motivation', 'IIT', 'UPSC motivation', 'IAS motivational video', 'attitude status', 'study motivation', 'IAS', 'UPSC status', 'IAS attitude status', 'IIT status', 'IPS', 'IPS status', '12th fail full movie in Hindi', 'LBSNAA', 'IIT Bombay', '12th fail', 'IPS entry', 'IAS motivation', 'UPSC syllabus', 'UPSC result celebration', 'IAS motivational song', 'motivational status', 'IPS Anshika Verma', 'UPSC attitude status']",10688310,510087,4316
M_oKjZVC0V8,Degrees Full Form | #shorts #ytshorts #fullform #viralvideo #education #gkfacts #upsc #newupdate,"Degrees Full Form | #shorts #ytshorts #fullform #viralvideo #education #gkfacts #upsc #newupdate Hello Everyone, Welcome ...",2024-10-16T14:21:00Z,Make Gk English,27,"['make gk english', '#generalknowledgequiz, #100gk, #indiagk, #gk, #gkinenglish, #gkquiz, #gkfacts, #gkindia, #gkforcompetitiveexam, #general_knowledge, #generalknowledge, #gkquestion, #gkvideo, #topgk, #generalknowledgequestions, #theworldofgk, #gkquestionsinenglish, #gkmcq, #top30indiagkquestionandanswer, #gkassam, #sscgk, #ssc, #sscexam, #bangalore, #hyderabad, #keralagk, #worldgk, #gkworld, #currentaffairsindia, #currentaffairs', 'new update', 'today news', 'hindi news', 'Full Form', 'hindi comedy', '#comedyshorts']",7262516,67000,80
72dc8VxyoqE,America&#39;s Education Crisis,Ready to increase your protein without adding unnecessary calories? Head to https://davidprotein.yt.link/9UxcRWy to get a free ...,2025-06-15T16:00:11Z,Cole Hastings,22,"['cole hastings', 'americas education crisis', 'education crisis', 'literacy crisis', 'america naep scores', 'ai essays', 'ai homework', 'ai in school', 'gen alpha worst generation', 'gen z', 'gen alphas education crisis', 'why education is failing', 'formal education', 'teaching crisis', 'elite college students cant read', 'kids cant read', 'the kids cant read', 'education crisis in america', ""america's education system"", ""america's education problem"", ""why college isn't worth it"", 'video essay', 'gen alpha']",263389,9004,1394
whw_kNOC-kg,ALPHABET GAME | Teacher Innovation Ideas | #alphabet #abcd #education #school #shorts #short #yt,Welcome to Teacher Innovation Ideas Our channel is one of the best place to learn new teaching strategies and methods Our ...,2025-07-17T12:07:55Z,Teacher innovation ideas,27,[],828526,4067,12
eI40kVc6ddE,Les animaux en famille 2 🇫🇷 #apprendre #enfants #débutant #education #maternelle #français,,2025-06-17T20:40:56Z,Kidi Fun,10,[],25868055,127225,0
vxmSNvBhm9A,Education -Floke Rose (VOY2017 Song Contest Winner),REAL EDUCATION NOW! VOY '17 song contest winner Floke Rose calls for changing the Myanmar education system and put ...,2018-06-15T05:07:38Z,Turning Tables,29,"['Turning Tables', 'Education', 'Floke Rose', 'Creative Activism', 'Critique', 'Hip Hop', 'Rap', 'Myanmar', 'Burma']",1181609,13231,151
YTzKHVzfsvE,Some Jokes I Found on the Bus | Todd Graham | Stand Up Comedy,"Comedian Todd Graham delivers one-liners about why he doesn't trust psychics, his friend's hot moms, and gender neutral ...",2025-09-29T19:00:29Z,Don't Tell Comedy,23,"['donttellcomedy', ""don't tell comedy"", 'stand up comedy', 'best comedy', 'stand up comedy full', 'stand up comedy full special 2024', 'stand up', 'standup comedy', 'comedy videos', 'funny clips', 'stand up comedy full special', 'funny jokes', 'dont tell comedy', 'best stand up', 'stand up comedy 2025', 'todd graham', 'todd graham comedian', 'todd graham stand up comedy', 'one liners', 'one-liners', 'new stand up comedy', 'andy huggins']",26455,1493,81
QubHqkYxzp0,દશેરા ની જલેબી ઓડર//Gujarati Comedy Video//કોમેડી વીડીયો SB HINDUSTANI ,,2025-10-01T01:30:31Z,S.B HINDUSTANI,23,[],518782,42643,902
54-Hg6VlaNs,Top Hundred of One Trending Very Special Video 😂Amazing Comedy Video 2025 Ep 348 By Busy Fun Ltd,"Top Hundred of One Trending Very Special Video Amazing Comedy Video 2025 Ep 348 By Busy Fun Ltd Hello Dear Viewers, ...",2025-09-30T04:00:07Z,Busy Fun Ltd,24,"['new funny video', 'comedy videos', 'funny clips video', 'funny video 2022', 'Busy Fun Ltd', 'new comedy videos 2022', 'fun video', 'top comedy videos', 'funny video 2023', 'comedy video', 'shorts funny video', 'viral comedy', 'challenging funny video', 'fun club', 'funny compitition', 'villege comedy', 'indian prank video', 'real life comedy', 'try not to laugh', 'top new comedy', 'most watch funny', 'totally amaizing funny video']",747933,2459,100
iiiC6ve8-YU,😂 Very Special Trending Comedy Video 2025 |Top Viral USA &amp; Canada Funny Show 🎭 Try To Not Laugh ‪,Very Special Trending Comedy Video 2025 | Top American Funny Show & Indian Comedy Clips Top 10 Viral Comedy ...,2025-09-26T05:15:03Z,MY FUN FAMILY 2.0,24,"['comedy fun 50', 'my family', 'busy fun ltd', 'funny family', 'comedy video', 'Trending Comedy Video 2025', 'Very Special Comedy Video', 'Top 10 Funny Videos 2025', 'American Comedy Show 2025', 'Best Indian Funny Video', 'Trending Stand Up Comedy', 'Viral Comedy 2025', 'Nonstop Laughter Video', 'Funny Show 2025', 'Best Comedy Clips 2025', 'Entertainment Video 2025', 'Top Funny Stand Up Comedy', 'Performance 2025 Try Not To Laugh 2025', 'Best American Comedy']",1740710,2993,37
W1FXk632mKE,Epic Funny Video 😂😂😂 #shorts #viralshorts #comedy #funnymoments #fails #humor,Epic Funny Video #shorts #viralshorts #comedy #funnymoments #fails #humor . . #funnyvideos #funnyanimalvideos ...,2025-01-21T12:30:06Z,FARUK_KHAN-CR7,23,"['#shorts', '#viralshorts', '#comedy', '#funnymoments', '#fails', '#humor']",93274570,929498,2722
nz-qD2Vr-BA,Autism Ain&#39;t For The Weak - Comedian Ronnie Jordan - Chocolate Sundaes Stand Up Comedy,Comedian Ronnie Jordan hilariously shares his experience raising a child with autism. Follow @RonnieJordan on social media: ...,2025-09-01T19:00:45Z,Chocolate Sundaes Comedy,23,"['chocolate sundaes comedy show', 'comedy show', 'stand up comedy', 'chocolate sundaes', 'chocolate sundaes comedy', 'comedy shows in los angeles', 'black comedians', 'stand up comedy show', 'black stand up comedy', 'black stand up comedian', 'black comedy show', 'standup comedy', 'stand up comedy on youtube', 'stand up comedy funny', 'good stand up comedy', 'stand up comedy video', 'any stand up comedy', 'comedy shows', 'most popular stand up comedy', 'best stand up comedy', 'comedy special']",176891,7750,388
nVSWMrHirhE,COLD DRINK CHOR || Part-3 Must Watch New Funny Comedy Video || Bindas Fun Nonstop,Disclaimer... This video is only designed for entertainment all its characters and events are fictitious. Watch the video just for fun.,2025-10-01T04:30:37Z,Bindas Fun Nonstop,23,"['NonStop Comedy', 'Funny comedy video', 'New Funny comedy video 2022', 'Best amazing video', 'Just for fun', 'Must watch comedy video', 'Funny video', 'Comedy Video', 'Indian funny Comedy Video', 'Comedy show', 'Funniest Video', 'Funny video 2022']",191857,985,14
Oy2QyPQ5L5M,Max Amini FULL COMEDY SPECIAL 2025 | &quot;Randomly Selected&quot; | Stand Up Comedy,"You've been randomly selected in my shows, now prepare to be Randomly Selected in your homes! Max Amini's comedy special ...",2025-02-05T16:30:11Z,Max Amini,23,"['Max Amini', 'Max Comedian', 'stand up', 'Standup', 'stand up live', 'stand up comedy', 'comedy shows', 'comedy', 'funny', 'humor', 'comedian', 'hilarious', 'comedy club', 'laugh out loud (LOL)', 'comedy special', 'jokes', 'stand up routine', 'satire', 'performance', 'comic relief', 'stand up comedian', 'comedy central', 'full special', '800 pound gorilla', ""don't tell comedy"", 'netflix is a joke', 'hularious']",15573704,197201,2358
uiDtSacl7JM,Aise bhulegi Saas Apna Jamana 😂 Comedy Shorts #comedy #funny #trending #shorts #youtubeshorts,Aise bhulegi Saas Apna Jamana Comedy Shorts #comedy #funny #trending #shorts #youtubeshorts #realme15T comes up ...,2025-09-03T10:18:57Z,Keshav Shashi Vlogs,22,"['Comedy video', 'Haryanvi comedy', 'Hindi Comedy video', 'funny comedy shorts', 'funny video', 'funny video haryanvi', 'haryanvi comedy video', 'keshav shashi vlogs', 'latest haryanvi jokes', 'new haryanvi jokes', 'shorts', 'viral comedy shorts', 'funny shorts', 'comedy shorts', 'sas bahu ki comedy', 'Viral', 'Reel', 'Trending', 'Comedy', 'Funny', 'Short', 'Ytshorts', 'Keshav', 'Shashi', 'Jokes', 'vlogs', 'Family']",37056771,854521,2199
M-B8IX9lTYo,"COMEDY NIGHT WITH CHAMPIONS || Episode 26 || Swastima Khadka, Prakash, Kiran, Rajaram, Sita",COMEDY NIGHT WITH CHAMPIONS || Episode 26 || HARI BAHADUR KO JUTTA Nepali Movie Special Episode || Swastima ...,2025-09-30T15:30:06Z,OSR Reality,24,"['osr reality', 'osr digital', 'comedy club with champions', 'comedy club comedy show', 'new comedy', 'COMEDY NIGHT WITH CHAMPIONS', 'comedy night', 'Jitu Nepal', 'Prabhat Lama', 'Suman Karki', 'Mexam Gaudel', 'kailash karki', 'sajan shrestha', 'comedy darbar', 'comedy night comedy', 'comedy', 'comedy night show', 'comedy show', 'comedy night episode 26', 'comedy night 26', 'comedy night video', 'comedy night hari bahadur ko jutta movie', 'swastima khadka', 'prakash saput']",243293,5868,326
y7vmu1ASFvc,Top Chinese comedy video 😂 | cartoon | champa chameli | funny comedy  viral video #shorts,TOPIC —Top Chinese comedy video | cartoon | champa chameli | funny comedy viral video #shorts क्या चंपा ...,2024-09-16T02:30:28Z,priyagan fun,22,[],71935924,0,402
GXFKlH3fJBU,Kwai Funny tiktok : Funny Videos 2025 Chinese Funny Video - Most View Chinese Funny Video,Kwai Funny tiktok : Funny Videos 2024 Chinese Funny Video - Most View Chinese Funny Video#funnychina #funnychinese # ...,2025-06-07T15:32:51Z,Fun studio 2007,24,[],16550391,0,355
Zn5F8_cxcH0,डायन के दशहरा भाग 3 [ New Comedy ] Dayan Ke Dashahara Bhag 3 Comedy ललटेनमा पर भ @UdaydoctorBodhgaya,डायन के दशहरा भाग 3 [ New Comedy ] Dayan Ke Dashahara Bhag 3 Comedy ललटेनमा पर भ ...,2025-09-26T13:15:43Z,devraj studio kurtha,23,"['dayan ke dashahara bhag 3 comedy', 'dayan ke dashahara bhag 3 comedy video', 'dayan ke dashahara bhag 3 laltenma ki comedy', 'dayan ke dashahara bhag 3 magahi comedy', 'laltenma ke dayan ke dashahara bhag 3 lcomedy video', 'dayan ke dahsahara lalten wala comedy', 'dayan ke dashahara bhag 3 lalten raja comedy', 'laltenma ke dayan ke dashahara bhag 3 comedy', 'laltenma ki comedy', 'laltenma ke new comedy', 'डायन के दशहरा भाग 3 कॉमेडी', 'lalten wala comedy', 'jhumki wala comedy', 'devraj studio kurtha comedyy']",805341,6006,207
kqQaME_vOsg,Funny Monkey viral video..🤣🤣🤣  #funny #comedy #trending #viral #shorts,Funny Monkey viral video..       #funny #comedy #trending #viral #shorts.,2024-08-10T07:05:00Z,prettysiya1M,24,['Funny Monkey viral video..🤣🤣🤣  #funny #comedy #trending #viral #shorts'],65794911,418803,1325
4U4CgcsyEI4,MURGI CHOR || New Funny Comedy Video || Bindas Fun Nonstop ,Disclaimer... This video is only designed for entertainment all its characters and events are fictitious. Watch the video just for fun.,2025-09-24T04:30:06Z,Bindas Fun Nonstop,23,"['NonStop Comedy', 'Funny comedy video', 'New Funny comedy video 2022', 'Best amazing video', 'Just for fun', 'Must watch comedy video', 'Funny video', 'Comedy Video', 'Indian funny Comedy Video', 'Comedy show', 'Funniest Video', 'Funny video 2022']",1034460,2870,43
ZjrTgUE4cPE,The Riyadh Comedy Festival Explained,Subscribe to Joke WRLD to Stay In The Comedy Loop! Get 20% off your next order with code JOKE at lucy.co/joke ...,2025-09-29T20:37:47Z,Joke WRLD,23,"['riyadh comedy festival', 'riyadh comedy', 'dave chappelle riyadh comedy festival', 'kevin hart riyadh comedy festival', 'bill burr riyadh comedy festival', 'shane gillis riyadh comedy festival', 'tim dillon fired', 'tim dillon riyadh comedy festival', 'pete davidson riyadh comedy festival', 'saudi comedy festival', 'comedians going to riyadh saudi comedy festival', 'bill burr saudi arabia', 'tim dillon fired from riyadh', 'saudi arabia comedy festival', 'saudi comedy festival reaction', 'saudi arabia comedy']",88461,2178,1381
rgk_-OvFB0A,Very Special Top Trending Comedy Video 2025 😂 latest amaizing funny video ep 233 By Our Fun Tv,ourfuntv #comedy #comedyvideo #comedyshorts #funny #funnyvideo #funnyshorts #tuituifunny #hasirvideo # Very Special Top ...,2025-09-29T08:36:46Z,Our Fun Tv,23,"['very special trending funny comedy video 2025', 'tranding funny video 2022 american funny video', 'totally amaizing funny video', 'trending funny video', 'new bangla funny comedy video', 'comedy funny video', 'funny video comedy', 'funny comedy videos', 'funny 2022 comedy 2022 top funny 2022', 'very funny comedy', 'new very funny videos', 'top new comedy video 2019', 'challenging funny video', 'comedy funny tv', 'funny video 2023', 'top comedy videos', 'funny video 2022']",3525694,8223,145
MIZGrsT5f1M,New top funny video 😅 #shorts #comedy #funny #reels,"New top funny video #shorts #comedy #funny #reels New top funny video, basir sk, funny, comedy, cartoon, jcb, tiktok, shorts, ...",2024-09-19T01:40:48Z,Basir Sk,23,"['New top funny video', 'basir sk', 'funny', 'comedy', 'cartoon', 'jcb', 'tiktok', 'shorts', 'most funniest video', 'most funniest video in the world', 'most funniest video in the world shorts', 'top comedy video', 'टॉप कॉमेडी वीडियो', 'funny shorts video', 'ziddi police', 'kaidi', 'chor police comedy', 'best funny comedy video', 'amazing story', 'the end', 'comedy version', 'funny version', 'new funny comedy video', 'best funny of two friends', 'chor', 'hasir video', 'respect', 'safik video', 'funny moments', 'comedy scenes', 'issie funny']",207371320,1821380,2282
JN2pOWhX7GE,डायन के दशहरा [ New Comedy ] Dayan Ke Dashahara Comedy ललटेनमा को दशहरा मे भुत आ @UdaydoctorBodhgaya,डायन के दशहरा [ New Comedy ] Dayan Ke Dashahara Comedy ललटेनमा को दशहरा मे भुत आ ...,2025-09-22T13:16:31Z,devraj studio kurtha,23,"['dayan ke dashahara comedy', 'dayan ke dashahara comedy video', 'dayan ke dashahara laltenma ki comedy', 'dayan ke dashahara magahi comedy', 'laltenma ke dayan ke dashahara comedy video', 'dayan ke dashahara lalten wala comedy', 'dayan ke dashara lalten raja comedy', 'laltenma ke dayan ke dashahara comedy', 'laltenma ki comedy', 'laltenma ke new comedy', 'डायन के दशहरा कॉमेडी', 'lalten wala comedy', 'jhumki wala video', 'jhumki wala comedy', 'jhumki wala new comedy', 'new comed', 'devraj studio kurtha comedyyy']",1307356,8427,215
X0D8BHRXssg,क्रिकेट वाला वीडियो ||🤣🤣🤣|| Lucky Comedy #shorts #trending #viralvideo,रिकेट वाला वीडियो ||      || Lucky Comedy #shorts #trending #viralvideo #Cricket wala Video #Gaon ka cricket ...,2025-04-30T13:30:24Z,Naman Jaunpuriya,23,"['#Shorts Comedy Video', '#Trending Comedy Video', '#Viral Comedy Video', '#Funny Comedy Video', '#Lucky Comedy Video', '#Pulley Comedy Video', '#Piyush Comedy Video', '#Naman Jaunpuriya', '#Youtube Comedy Video']",47103644,461536,0
oawMfCMLkHU,James Donald Forbes McCann | BLACK ISRAELITE | Stand Up Comedy,"I'm going on tour with new and different jokes. Tickets on sale at https://www.jdfmccann.com/gigs HOUSTON, TX - SEPTEMBER ...",2025-09-02T00:30:06Z,James Donald Forbes McCann,23,[],1008713,55654,3528
FSHKhK16NH4,Suraj Rox comedy funny shorts muh se nikal gaya #like #comedy #funny #comedyvideos @adpvlog7994,,2025-06-12T06:30:08Z,PAWAN ROSHAN,24,[],26819106,244373,583
HI0rLHBUIgQ,Happy ending🥹🥰💀 #song #music #entertainment #love #farewellvibes #comedy #funny #pov #relatable,,2025-09-30T11:33:31Z,Rafeel pvc,22,[],571059,18569,310
UOLPeN6b3pI,Words Are Violence - Comedian Kira Soltanovich - Chocolate Sundaes Comedy Show,One harmless chat with a “Gen-Z-er” was all it took for Kira Soltanovich to realize—her words have the power to cause serious ...,2025-08-22T19:41:21Z,Chocolate Sundaes Comedy,23,"['chocolate sundaes comedy show', 'comedy show', 'stand up comedy', 'chocolate sundaes', 'chocolate sundaes comedy', 'comedy shows in los angeles', 'black comedians', 'stand up comedy show', 'black stand up comedy', 'black stand up comedian', 'black comedy show', 'standup comedy', 'stand up comedy on youtube', 'stand up comedy funny', 'good stand up comedy', 'stand up comedy video', 'any stand up comedy', 'comedy shows', 'most popular stand up comedy', 'best stand up comedy', 'comedy special']",8660,489,50
M1_TdtQCLHM,What do we call this now!🤦‍♂️💔😂,,2024-06-01T09:24:54Z,Skinnycomics,23,[],3098925,168582,1511
kUD6CPlKVto,Kannada comedy #kannada #kannadacomedy #kannadanews #dboss #shorts #shortsvideo #funny #comedy #fun,,2025-06-23T05:16:12Z,swathi gowda YT,24,[],3302965,31754,80
l_UTBFco1eE,the and 😂🤣pt-33 #funny #fails #funny #shorts,the and pt-33 #funny #fails #funny #shorts Funny moments Funny fails The end Shorts Short video NOTE:-This Video is for ...,2025-06-18T13:45:22Z,Mr_arbaz_qureshi_007,22,"['funny videos', 'funny moments', 'funny memes', 'viral video', 'trending shorts', 'trending video', 'funny', 'fails', 'comedy', 'you tube shorts', 'shorts feed', 'instagram reels', 'tiktok', 'shorts video']",9844605,75994,95
8V0Rg8J4jpo,Want to LAUGH Uncontrollably? Watch This Funny Video Now #funny #cute,"Welcome to the omnivorous saint channel video, if you find it interesting, please subscribe to the channel and share it with me, ...",2025-08-08T11:24:32Z,THÁNH ĂN TẠP,24,"['shorts', '腾讯', '强者', '玄幻', 'ideas', 'blox fruits', 'tiktok', '123 go', 'dad jokes', 'stand up', 'dhar mann', 'living in a tent', 'survival skills', 'lifehacks', 'anicaps', 'meme', 'street food', 'funny cat videos', 'funny fails', 'watchmojo', 'movie recap', 'anime plot', 'xem tử vi', 'dang voi dan', '短剧', 'mangas', 'anime recap', 'anicap', 'manga recap', 'webtoon', 'trending shorts', 'juan de dios pantoja', 'funny fail', 'giá vàng 18k', 'funny videos', 'anirecap', 'best memes', 'try not to laugh', 'funny animal', 'smart', 'best shorts', 'manga recaps', 'animecaps']",103598481,335617,94
0nTzRag1hWc,Unga mama ipadi thana ? #shorts #shortvideo #shortsfeed #trending #funny #comedy #money #like,,2025-04-20T13:33:38Z,NRFM-VLOGS,24,[],9965141,254089,996
1F5P89gUfVE,Aiyooohhh APPAA.....😭😭😂🤣 #nrfm #nrfmvlogs #trending #comedy #funny #shortsfeed #shorts #like,,2025-04-04T13:30:02Z,NRFM-VLOGS,24,[],15444791,424746,658
FmO9KR6OV9Q,Lift 3 🙄 #comedy #trending #viral #girl #shorts,,2025-06-05T12:44:37Z,Harrish krish,23,[],3421491,112169,153
FowEe1z-piM,चाचा के पुजारी मेहरी 😂😂😂/#reel/#comedy/#video/#sonumalang/,,2025-06-19T07:39:07Z,sonu malang,23,[],5143345,56065,140
Zkn4ktUawHI,Aprm en da Kora soldringa 😫👊🏼 #harishhatricks #comedy #youtubeshorts #tamilcomedy,,2025-08-03T14:04:18Z,Harish hatricks,22,[],2357262,73422,109
BK6nKOnhtTA,Ada pavi🥺😡😂#tamiltughlife #comedy #husbandwifealaparaigal #funny #husbandsothanaigal #jokes,,2024-06-16T12:58:50Z,The Couples Hub,24,[],4513061,145992,242
9S_8_fpIIm8,Very Special Top Trending Comedy Video 2025 😂 latest amaizing funny video ep 233 By Bidik Fun Tv,ourfuntv #comedy #comedyvideo #comedyshorts #funny #funnyvideo #funnyshorts #tuituifunny #hasirvideo # Very Special Top ...,2025-09-29T13:00:27Z,Bidik Fun Tv,23,"['very special trending funny comedy video 2025', 'tranding funny video 2022 american funny video', 'totally amaizing funny video', 'trending funny video', 'new bangla funny comedy video', 'comedy funny video', 'funny video comedy', 'funny comedy videos', 'funny 2022 comedy 2022 top funny 2022', 'very funny comedy', 'new very funny videos', 'top new comedy video 2019', 'challenging funny video', 'comedy funny tv', 'funny video 2023', 'top comedy videos', 'funny video 2022']",166510,3144,30
DpU0vE3JDhM,Share your boys🤣❤️ #travel #comedy #shorts #vinayagar,,2024-09-06T14:01:42Z,Rajkzr ,22,[],3041874,82973,70
362O_9L1KI8,#mukalepparealteam #comedy,mukalepparealteam #comedy.,2025-05-20T02:40:19Z,Kaveri short ,22,[],6996584,72126,97
