video_id,title,description,published_at,channel,category_id,tags,view_count,like_count,comment_count
zu8ITCx5ZBE,HUAWEI&#39;s New iPhone17 KILLER...(Apple is Done),What China's Doing With Tech Will Shock You...(Forget Apple) See how Huawei is pushing boundaries with a new folding phone ...,2025-09-29T11:01:44Z,Living in China,19,"['huawei', 'china', 'living in china', 'iphone', 'apple', 'phone', 'iphone 17 pro', 'iphone 17', 'iphone air', 'apple event', 'iphone 17 pro max', 'new iphone', 'apple in done', 'forget apple', 'new iphone killer', 'huawei new phone', 'huawei matebook fold', 'huawei mate xts', 'huawei folding phone', 'huawei china', 'china news', 'chinese phone', 'iphone vs huawei', 'china vs usa', 'china life', 'china travel', 'china vlog', 'huawei store', 'huawei car', 'huawei electric car']",74260,4766,604
RHtnrzct2RM,The latest Chinese technology trends are amazing,techno #short #technology #newphone.,2021-10-18T21:51:15Z,World New News every day,25,[],1013827,7849,67
VnZG9Zi73wI,Others Technologia Vs TheLastOne 🤯💀,Others Technologia Vs TheLastOne #usashorts #technology #technologia #technologie #usacontent #skulledit #newedit ...,2025-05-30T12:30:39Z,DEVU SIGMA,24,[],25678112,381221,555
T-F-vVNVQ50,Coolest New Technologies of 2025,"Coolest DIY Videos ▻ @YouBuildDIY This year's tech unveils are redefining what's possible, blending creativity and innovation to ...",2025-01-20T14:00:28Z,YouFact Tech,28,"['you fact tech', 'you fact', 'ufact', 'gadgets', 'technologies', 'CES 2025', 'ai gadgets']",1025783,6228,452
i5R1Yxh0Kc8,Amazing Power Full Tractor Work In The Field #tractor #farming #automobile #technology #shortvideo,,2025-06-16T05:45:02Z,Technology ,22,[],2346595,13185,15
8SIcDkceVsw,When Technology Becomes Art #Meibot #future #robot #art #tech #technology,When Technology Becomes Art #Meibot #future #robot #art #tech #technology.,2025-06-14T16:18:14Z,Meibot,22,[],8508751,29878,141
e92Y3yx9u-A,3 Weirdest Minecraft Tech Products,3 Weirdest Minecraft Tech Products.,2025-06-27T12:42:32Z,Dantic,28,"['dantic', 'tech', 'gaming', 'minecraft', '3 Weirdest Minecraft Tech Products', 'minecraft tech']",2296338,59142,118
4wZwXhoxRIA,15 Tech Gadgets I Use Every Day #shorts #justicebuys #tech,,2025-01-04T19:26:39Z,Justice Buys,22,[],18850367,619803,2565
J0Uk9a7a7Ls,Why China Is Rulling The Market | Leads in Development &amp; Tech?#development#china#india#shorts,"सोचो ज़रा… अगर कल को आपकी हड्डी टूट जाए और डॉक्टर बोले – '3 मिनट रुको, ...",2025-09-29T13:00:33Z,Learn with Shivam 🔥	,27,"['Why China Is Rulling The Market', 'china', 'xi jinping', '3 Minute Fracture Fix Without Surgery', 'living in china', 'deng xiaoping', 'China vs India', 'Leads in Development & Tech', 'China Bone Glue', 'Medical Technology Innovation', 'China Technology', 'Bone Healing', 'Future Medicine', 'Bone Glue', 'China Tech', 'Medical Science', 'Innovation', 'development', 'india', 'shorts', 'technology', 'Leads', 'Development', 'Tech', 'ChinaVsIndia', 'Technology', 'IndiaChinaComparison', 'WhyChinaIsAhead', 'GlobalGrowth', 'IndiaFuture', 'EconomicDevelopment']",412,17,0
gsJAlLOFBv0,TINY Tech That Actually Works,,2025-05-02T17:37:10Z,Mrwhosetheboss,28,"['tiny', 'tech', 'gadgets', 'small', 'miniature']",10546739,279342,582
lCHqmzynO-s,Overrated vs. Underrated Tech,Join my Discord server: https://discord.gg/gohar I'll edit your college essay: https://nextadmit.com/services/essay/ Get into ...,2024-07-08T18:04:31Z,Gohar Khan,27,[],22943402,930916,2773
uvG-WToQfU4,Old Or New Technology?,Follow me here: Instagram ▻ https://www.instagram.com/sambucha X ▻ https://www.x.com/sambucha Become a Member: ...,2024-07-17T19:15:02Z,Sambucha,24,[],3783816,245980,2507
iPJfSknuO8I,I&#39;m the best technology moment ☠️,,2025-05-07T09:45:42Z,The Goat Saga,22,"['Troll face', 'troll face edit', 'trending edit']",547455,6947,36
KArch4rjU_0,USB in USB #charger #technology #electronic #funny,Maybe stop plugging things into each other to see when they fail!!!,2024-05-12T17:37:14Z,ElectroBOOM,28,[],46738503,2132701,5858
IOVKA9eBzkw,New invention #scienceproject #inventions #technology #tech #shorts,scienceproject #schoolproject #technology #inventions #gadgets #ideas #science.,2024-09-10T13:23:57Z,Mr. Deshi Inventor ,28,"['new invention', 'invention', 'DIY project', 'DIY idea', 'homemade invention', 'homemade DIY project', 'shorts', 'youtube shorts', 'trending shorts', 'science project', 'new technology', 'smart gadgets', 'science', 'technology', 'gadgets']",619757,4058,32
De7s-IB_DAw,You&#39;re wasting money on Tech.,Leave a comment with how much this saved you :) Go to https://surfshark.com/boss or use code BOSS at checkout to get 4 extra ...,2025-05-21T09:03:41Z,Mrwhosetheboss,28,"['money saving', 'finance', 'save money', 'get things cheaper', 'subscription services', 'netflix', 'spotify', 'youtube', 'disney plus', 'apple', 'iphone', 'subscription']",2787907,97756,4974
ZSsrYRT99Yg,Samsung galaxy s23 ultra miniature unboxing 🤩🤩,,2023-05-03T16:06:36Z,SA Edition,28,[],88625451,2333847,11178
Otim2mDjsYM,Top 17 New Technology Trends That Will Define 2026,"In this video, we reveal the top 17 breakthrough technology trends that are set to transform the way we work, live, think, and ...",2025-07-30T23:28:45Z,AI Uncovered,28,"['top 17 new technology trends that will define 2026', 'technology trends 2026', 'new tech 2026', 'emerging technologies 2026', 'future technology 2026', 'ai trends 2026', 'top tech trends 2026', 'what tech is coming in 2026', 'new innovations 2026', 'upcoming tech trends', 'future technology predictions', 'disruptive tech 2026', 'robotics 2026', 'biotech trends', 'smart cities 2026', 'web3 innovations 2026', 'brain computer interface 2026', 'tech that will change the world', 'latest technology updates 2026']",264664,3755,227
2ru4Nsab94w,creators give tech hot takes,We ask @ZachsTechTurf @TechJoyce @nerdonabudget and @MachoNachoProductions for their tech hot takes!,2025-09-01T18:49:00Z,Linus Tech Tips,28,[],1118446,40397,1462
iuLgq7bf6QY,New Innovation - 6 💥 #new #innovation #unique #tech #shorts,New Innovation - 6 #new #innovation #unique #tech #shorts.,2024-05-22T07:16:40Z,Your Mahbub,26,[],34626534,669750,2012
gkklrVa8amY,The Most Futuristic Tech Of 2025.....,"Dive into the future with us at MWC Barcelona! We've uncovered tech that'll blow your mind, from earbuds that redefine audio to a ...",2025-03-06T10:09:46Z,TechWiser,28,['TechWiser'],931148,60554,215
vwTL0SLEl1M,The New Connector That Beats HDMI and DisplayPort 🤯,,2025-08-25T21:39:44Z,Zach's Tech Turf,20,[],1395874,61233,2093
MBQBY9b6OAU,I Tested Every YouTuber Tech Product,I tested tech products from the biggest YouTubers. Go to https://surfshark.com/boss or use code BOSS at checkout to get 4 extra ...,2025-04-14T11:18:58Z,Mrwhosetheboss,28,"['youtuber', 'products', 'mkbhd', 'panels', 'tech', 'mark rober', 'ryan trahan', 'youtube']",6806616,178849,9186
82jYblR16QM,4 times tech SURVIVED disaster,"shorts #tech #smartphone #gadgets I spend a LOT of time trying to make my videos as concise, polished and useful as possible ...",2024-04-29T08:46:02Z,Mrwhosetheboss,28,[],9354473,661479,2383
vfvQ-HRUm8Y,Why Did They Kill Your Childhood Tech?,shorts #tech #technology #techvideo.,2025-08-21T19:44:08Z,The Studio,28,"['MKBHD', 'The Studio']",1882790,51374,788
uOQcmm0xDuI,My Top 5 Tech Accessories!,,2024-07-16T16:47:43Z,Brandon Balfour,22,[],636876,32004,98
5fKkXFresYI,5 Times Tech has SAVED LIVES!,"shorts #technology I spend a LOT of time trying to make my videos as concise, polished and useful as possible for you - if you ...",2022-10-15T08:25:08Z,Mrwhosetheboss,28,"['tech', 'shorts']",41087373,2637379,8312
qqeZ5Hcw1Tg,Meanwhile Android 💀,trollface #troll #editing #trending #zqotiz #viralshorts #phonk #aura #sigma #explore #fun #funk #viral #edits #zqotizedits #shorts ...,2024-12-25T18:31:43Z, ZQotiz,24,[],67276853,1737682,10901
47gDOw_PNrw,New invention 🇮🇳 #technology #dcmotor #diy #shorts,New invention #technology #dcmotor #diy #shorts other video link ...,2025-06-11T12:14:42Z,Thanks Invention,28,"['Thanks Invention', 'DC motor', 'motor', 'Invention']",32023431,86990,79
5upVC6YzQCE,Replacing my 3080 with a 4090 for 4K #gaming. #tech #pc #technology #shorts,Today I have a custom gaming pc that's getting an RTX 3080 swapped out with an RTX 4090. Overkill? Yes! This is my personal ...,2023-09-19T00:54:11Z,Salem Techsperts,28,[],38151559,1593872,14242
lo4bA4p3MBQ,I bought the LAZIEST Tech ever.,"Testing tech products that claim to cook for me, clean for me, make my bed for me - to work out how much effort they actually save.",2025-09-03T12:14:29Z,Mrwhosetheboss,28,"['laziest', 'tech', 'gadgets', 'i bought', 'cooking robot', 'posha', 'best tech', 'gifts']",8603001,181757,5417
ABw-VNs2hdM,Me from the #90s seeing computer technology from today. #nostalgia #90skids #millennials,,2025-05-08T23:35:06Z,MelissaKristinTV - DigitalMunchies,28,[],2049672,87029,493
9ehLMlVTRJM,44 Reasons Why I Hate Tech,Score great deals with NexiGo at https://www.nexigo.com/pages/prime-day-2025 I hate computers. I hate Nintendo Switch 2.,2025-07-16T17:08:55Z,Linus Tech Tips,28,"['linus tech tips', 'ltt', 'tech rants', 'tech gripes', 'pc hardware', 'microsoft one drive', 'discord nitro', 'hdmi cec', 'usb c', 'display port', 'switch 2', 'joy-con drift', 'nintendo dock', 'steam', 'windows backup', 'file sync', 'pc building', 'display settings', 'kill switch 2', 'tech annoyances', 'linus rant']",1299977,53286,4551
ewmRD0MacxI,Top 3 Smartphone gadgets under ₹50||🔥🤯 #shorts #gadgets #viralvideo #ytshorts,Top 3 Smartphone gadgets under ₹50||     #shorts #gadgets #viralvideo #ytshorts top 3 unique gadgets cool unique gadgets ...,2024-12-10T10:30:15Z,v3 facts ,27,"['shorts', 'gadgets', 'amazing gadgets', 'unique gadgets', 'unique cool gadgets', 'usefull Gadgets', 'Top 3 Smartphone gadgets', 'Top 3 Smartphone gadgets under 50', 'Top 3 Best Unique Gadgets', 'boys gadgets']",3747250,0,30800
YfSvv6l9yxQ,New Tech From HUAWEI is INSANE!,What do you guys think? #huawei #china #chinatravel.,2025-03-31T13:28:48Z,KSquared,19,"['huawei', 'new tech', 'new tech from china', 'china tech', 'china is the future', 'china travel', 'china food prices', 'china prices', 'chinese tech', 'huawei phones', 'travel to china', 'new phone', 'new phone tech', 'new phone upgrade', 'apple vs huawei', 'samsung vs huawei']",150329,1543,68
7jGU0wPOKzc,Why you can’t steal from an Apple Store!,,2025-07-07T13:38:24Z,Mrwhosetheboss,28,[],24115331,917951,9066
ICL9LXZvjes,4 SINFUL Tech Pranks - HIDE YOUR FRIENDS 👺,Do consider subscribing to my Shorts Channel! Main Mrwhosetheboss YouTube Channel: ...,2021-09-04T10:28:48Z,Mrwhosetheboss Plus,28,"['shorts', 'tech', 'iphone', 'smartphone', 'hacks', 'mrwhosetheboss', 'pranks', 'tech pranks', 'ios']",29346420,2030057,6274
aDt7WrHTnYw,Other Technology vs The Last One 🧠💡| #edit #technology #newyork #usa,"Note: This video uses edited clips from a source, which I've credited below. If you're the creator of any clip and have concerns, ...",2025-06-28T13:32:21Z,Viral Burnz,22,"['edit', 'technology', 'trollface', 'usa']",9303503,0,218
9H7v3aG2Exc,5 Most DANGEROUS Tech Products,Do consider subscribing to my Shorts Channel! Main Mrwhosetheboss YouTube Channel: ...,2022-03-14T12:51:10Z,Mrwhosetheboss Plus,28,"['shorts', 'tech', 'iphone', 'smartphone', 'hacks', 'mrwhosetheboss', 'technology', 'gadgets']",16993697,1323475,4070
LZYfSYXY-go,Apple’s THINNEST ever device is RIDICULOUS!,"shorts #tech #gadgets #apple #iphone I spend a LOT of time trying to make my videos as concise, polished and useful as possible ...",2024-01-04T15:32:23Z,Mrwhosetheboss,28,"['apple', 'iphone', 'tech', 'gadgets', 'shorts', 'thinnest', 'smallest']",18062765,840599,3657
KCeEjhDMIv4,Samsung S22Ultra screen quality display. #Samsung #reel #reels #s23ultra,Instagram - https://www.instagram.com/techcave_ Copyright Disclaimer- Copyright Disclaimer under section 107 of the Copyright ...,2023-07-15T07:18:44Z,Tech Cave,28,[],175459162,1386827,7115
tvNV2MweDJ0,IOT Home Automation #arduino #project #iot #technology #ytshorts #ideas,IOT Home Automation using arduino esp 8266 #arduino #project #iot #technology #ytshorts #ideas Complete video link ...,2024-08-31T15:46:53Z,XiLiR Technologies,27,[],455774,5126,83
ie-Bj_xcYQI,2025 New Smartphone 🔥#smartphone #china #ytshorts #factsinhindi,2025 New Smartphone #smartphone #china #ytshorts #factsinhindi #universe #technology #ai.,2024-09-03T14:01:52Z,UNSEEN FACTS ,26,[],235283,1879,14
MBpIM7Ks-Tc,Cleaning a Laptop that&#39;s GROSS and overheating (HUGE Alienware FAIL) #pc #tech #technology #shorts,Disgusting Alienware laptop is overheating and needs a deep cleaning. A high performance computer like this Alienware M15 R7 ...,2024-08-18T21:47:03Z,Salem Techsperts,28,[],15003628,693544,3365
nA6ZdAZqloc,I hate AI.,,2025-02-14T18:00:43Z,Linus Tech Tips,28,[],1519611,81743,1578
J88fOMC_o14,3 Places you can find a remote job 👩‍💻🌎 #technology #programming #career #wfh #productivity,,2022-04-15T15:18:49Z,Coding with Lewis,28,[],473615,34807,138
mvvD21aUYeA,5 Sneakiest Tech Pranks EVER 😈,"5 of my Favourite Tech Pranks Ever - If you're enjoying my shorts, a sub to the channel would make my day! #shorts #iPhone ...",2022-09-05T16:54:36Z,Mrwhosetheboss,28,"['shorts', 'tech', 'pranks', 'prank', 'iphone', 'android', 'phone', 'smartphone']",43171389,2734550,5448
nyjuAqhaPaE,New Toilet Technology! 🤣😂 (best animation memes) #shorts,,2025-03-21T16:01:03Z,Avenu Animations,24,"['toilet', 'poop', 'toilet technology', 'automatic poop cleaner', 'rico animation', 'funny videos', 'avenu animation', 'funny meme videos']",7710040,133902,283
FelN4AKUfJI,Top 3 Best Useful Chinese Gadgets #tech #gadgets #short,I'm going to tell you about three Chinese gadgets that are useless to me but might be 100% useful to you. These gadgets look ...,2025-08-18T11:23:16Z,GUFRAN TECH ,28,[],893551,49424,114
kl9CvjeaddA,3 Tech Pranks to drive your friends Crazy 😂,Do consider subscribing to my Shorts Channel! Main Mrwhosetheboss YouTube Channel: ...,2021-06-27T11:22:38Z,Mrwhosetheboss Plus,28,"['shorts', 'tech', 'iphone', 'smartphone', 'hacks', 'pranks', 'tips', 'tricks', 'phone tips']",29387082,2092996,7781
xRbPAVnqtcs,[MV] BOL4(볼빨간사춘기) _ Travel(여행),[MV] BOL4(볼빨간사춘기) _ Travel(여행) *English subtitles are now available. :D (Please click on 'CC' button or activate ...,2018-05-24T09:00:04Z,1theK (원더케이),10,"['Kpop', '1theK', '원더케이', 'loen', '로엔', '뮤비', '티져', 'MV', 'Teaser', '신곡', 'new', 'song', '한류', 'hallyu', 'ロエン', 'ミュージック', 'ミュージックビデオ', 'ケーポップ', '韓国の歌', 'アイドル', '韓流', '韓国', '아이돌', 'idol', 'BOL4', '볼빨간사춘기', 'Travel', '여행']",107386715,623157,26191
c6bAndS9oqY,Places On Earth That Don&#39;t Feel Real #travel #nature #adventure #explorepage,Places On Earth That Don't Feel Real #travel #nature #adventure #explorepage.,2025-05-27T01:30:34Z,GreenFX World ,22,"['explore world', 'explore places', 'shorts', 'nature', 'adventures', 'travel places', 'travel', ""place on earth that don't feel like real"", ""place on earth don't feel like real"", 'place that earth not feel like real', ""place that don't feel real"", 'place that feels like unreal', 'unreal places', 'unreal wonders', 'our great world', 'our awesome world', 'our great world Shorts', 'our awesome world Shorts', 'Instagram vs reality', 'naturelovers', 'landscapephotography', 'expectations', 'adventures travel']",7125224,79061,113
3iAiWIytqdw,Forever Young - Music Travel Love ft. Bugoy Drilon,"Get ""Forever Young"": Smart URL: https://lnk.to/5oxrLPPd Spotify: https://spoti.fi/4j3wJki iTunes: https://bit.ly/3RPNWSd Amazon: ...",2025-04-16T00:00:08Z,Music Travel Love,10,"['Music Travel Love', 'musictravellove', 'Forever Young', 'Forever Young Cover', 'Bugoy Drilon', 'Whang-od', 'MTL', 'Lyrics', 'Live', 'Cover', 'Philippines', 'Classic 80s Music', 'Forever Young Alphaville Cover', '80s Songs']",16402599,124735,4244
36cmcLoSYiE,Jaipur To Mumbai Journey 🚂 #mariakhan #shorts @sadimkhan03 @mukeem03,team03 #sadimkhan #shortsviral #shortvideo #youtubeshorts #trending #jaipur #mumbai #train #travel #journey #station #vlog ...,2025-05-25T04:30:01Z,Maria Khan,22,[],19844156,427659,1291
FIODkqCxJY0,&quot;DON’T Go to Vietnam!&quot; 🇻🇳 #vietnamtravelguide #travel #vietnamtravel #hochiminh #hanoi #hoian,,2025-02-04T23:00:09Z,Find Out Why,22,[],2973444,69729,4079
0NuwakAGiTg,Mathura Vrindavan One day Itinerary. #mathuravrindavan #travel,,2025-01-28T13:04:03Z,Swapnali Gupta 11M views,22,[],348290,15053,178
ILJkRQwhDec,That&#39;s the Way It Is - Music Travel Love ft. Bugoy Drilon,"Merch https://www.musictravellove.com Get ""That's the Way It Is"": Smart URL: https://lnk.to/BQPWLXy3 Spotify: ...",2024-09-12T00:00:05Z,Music Travel Love,10,"['music travel love', 'musictravellove', 'thatsthewayitis', ""That's the way it is"", 'Cover', ""Celine Dion That's the Way It Is"", 'Bugoy Drilon', 'Live', 'Lyrics']",29865901,123307,4370
sf3PiPKlC8M,25 Best Places To Visit In Caribbean Islands 2025 | Travel Video,25 Best Places To Visit In Caribbean Islands 2025 | Travel Video #caribbean #caribbeanislands #travel #bestplacestovisit ...,2025-03-29T15:30:30Z,Scenic Hunter,19,"['25 Best Places To Visit In Caribbean Islands 2025', 'Travel Video', 'travel', 'Anguilla', 'most beautiful caribbean islands to visit', 'nature', 'ocean', 'sea', 'west indies', 'caribbean islands travel guide', 'caribbean islands 4k', 'caribbean islands', 'st lucia', 'Martinique', 'caribbean islands to visit', 'Caribbean islands itinerary', 'Caribbean islands tours', 'Caribbean islands documentary', 'Caribbean islands travel vlog', 'Caribbean islands travel video', 'Caribbean Isalnds', 'Caribbean queen', 'Caribbean beach']",282244,1816,232
BudcYUlufHo,But what is it with SOLO TRAVEL?!🤍🩵🧡♥️ #minivlog #solotrip,,2025-02-24T05:30:04Z,Mitali This Side!!,22,[],4753512,164596,403
mkfSZDwAaf8,Place On Earth That Don&#39;t Feel Real #travel #explore #expectations #adventure #shorts,Place On Earth That Don't Feel Real #travel #explore #expectations #adventure #shorts.,2025-01-11T01:30:34Z,GreenFX World ,22,"['explore world', 'explore places', 'shorts', 'nature', 'adventures', 'travel places', 'travel', ""place on earth that don't feel like real"", ""place on earth don't feel like real"", 'place that earth not feel like real', ""place that don't feel real"", 'place that feels like unreal', 'unreal places', 'unreal wonders', 'our great world', 'our awesome world', 'our great world Shorts', 'our awesome world Shorts', 'Instagram vs reality', 'naturelovers', 'landscapephotography', 'expectations', 'adventures travel']",21707939,286718,453
9oZVMcF55tQ,UNSEEN WONDERS | Hidden Places Even Locals Can’t Believe Exist | Travel Video 4K,"UNSEEN WONDERS | Hidden Places Even Locals Can't Believe Exist | Travel Video 4K Some places are so well hidden, even ...",2025-04-10T11:27:27Z,New Travel Insight,19,"['4k video', 'travel', 'unreal places', 'natural wonders', 'travel channel', '4k', 'World', 'Earth', 'wonders of planet', 'travel video 4k', 'travel guide', 'travel documentary', 'travel explore', 'natural beauty', 'unreal wonders of', 'planet travel', 'unreal planet', 'planet earth', 'UNSEEN', 'Secret Side', 'HiddenPlaces', 'TravelVlog', 'HiddenGems', 'TheSideYou’ve NeverSeen', ""Even Locals Don't Know About"", 'unseen wonders', 'travel 4k', 'locals surprised', 'travel secrets', 'hidden gems', 'Even Locals Can’t Believe Exist']",7126007,17773,875
sUw95CjASP8,"dual income, no kids and travel vibes ✈️ #travelgoals #relationship",,2025-05-12T05:30:23Z,Prakriti & Ashish | Escape to Landscapes,19,[],20941363,539587,6726
95OHaQFzOv4,Antarctica Ship Tour - ₹7.5 lacs/ person 😄 #shorts #antarctica,Trip with Ocean Expedition.,2025-05-06T05:13:51Z,WanderDa,19,[],6545467,199185,494
W85nPbOx8CQ,3 things you need to survive a 16hr flight in economy #traveltips #flighttips #amazonfinds #travel,,2025-07-02T22:03:57Z,Destiny Benway,22,[],2616725,102192,401
KFvjU8y1x54,₹200 wala 10 me😂 #minivlog #shorts,Hope you love this mini vlog! Keep supporting Keep smiling Thanks Instagram:- travelerram.,2023-07-07T03:00:16Z,Traveler Ram,22,"['new mini vlog', 'traveler ram', 'travelling by Indian railways', 'travel vlog']",13173485,740336,421
2FWztZP5cu8,Let’s art and have a good time 🤩❤️#viralshorts #drawing #travel,,2024-12-07T04:28:22Z,Artist Akash,1,[],21884789,746453,886
W7eejrlrweM,✈️ travel journal with me on my flight to japan ft. @ANAGlobalCH #japantrip #japantravel,,2024-05-04T12:00:33Z,lootengstudio,22,[],1037060,54541,233
-nOeh-9mKBo,Meesho Travel Finds Under Budget You Should Try! #meeshofinds #meeshoapp #meesho #travel #viral,Here's the link for the items https://www.wishlink.com/yinandyang35/post/2601952 Or check my community post HOW TO CHECK ...,2025-08-25T08:27:05Z,Debopriya Majumder,22,"['Meesho', 'travel finds', 'affordable travel essentials', 'budget travel', 'Meesho haul', 'packing hacks', 'under budget', 'viral products', 'must have travel items', 'travel friendly finds', 'Meesho travel haul', 'traveling items']",402966,16759,70
OekdUrh4Sjg,Travel with me✈️! #travel #facemask #vlog #makeup #skincare #gdwm  #grwm #dayinmylife,,2025-07-16T17:00:28Z,♡ Victoria Emily ♡,22,[],4388554,88020,523
QjnjIUh-eIw,Day 2 in India’s longest train journey #train #assam,"Contact For Paid Promtion - theupendraa@gmail.com What Is Bharat Bhraman: The Adventure Begins"" suggests an exciting ...",2024-10-16T03:51:57Z,the upendraa,22,[],43319518,1444293,589
KzqoSeVMGrQ,Let It Be - Music Travel Love &amp; Friends (Al Wathba Fossil Dunes in Abu Dhabi),The serene beauty of Al Wathba Fossil Dunes #InAbuDhabi shines in the second release of the music video series by Music ...,2024-03-06T01:00:08Z,Music Travel Love,10,"['Let It Be', 'Music Travel Love', 'Let It Be Cover', 'Cover', 'Lyrics', 'The Beatles Let It Be', 'In abu dhabi', 'Live', 'Music Travel Love Cover', 'Classic Music']",46828124,316338,7340
qU6bxRPltkk,How many flags can you count? #travel #travelamore #traveling #travelvlog #trending #2024 #recap,,2024-12-24T12:51:10Z,Aakanksha Monga,19,[],11399875,287186,3363
K_LkIqwKWEc,I reached the most expensive country in the world #ytshorts #hongkong #vlog #travel,To support this channel you can become a member here- https://www.youtube.com/channel/UC19x8yVdc96ogGHQyb4gfwg/join ...,2025-08-22T17:14:42Z,wittySpace,22,[],2649727,89552,235
AUW4HszJrqI,🎉 Brainrot Footballers Monaco Trip Vlog with Real Players 🚁🇲🇨,brrbrrpatapim #ballerinacappucina #tralalerotralala #CristianoRonaldo #Neymar #Messi.,2025-07-28T09:00:22Z,Mr. Melt,1,[],17086275,105425,328
tE4eEOfR7cg,#599 Train Journey Begins | Kochi to JAMMU,therainbowgirlvlogs Hope you all like it Plz like share subscribe ...,2024-10-13T15:15:17Z,therainbowgirl,24,[],8082567,297647,739
mjw_O87pvt0,New caravan trip start 😍🚐#ghumakkadbugz #campervans #northeast #vanlife #india,,2025-05-26T02:53:34Z,Ghumakkad bugz,19,[],7116638,64430,331
KBNHqI4kono,50 Most Beautiful Places To Visit In Europe in 2025 | 4K Travel Guide,"An extraordinary journey through Europe's wonders in 2025, captured in magnificent 4K footage that will transport you from the ...",2025-02-02T07:00:10Z,EpicExplorationsTV EN,19,"['europe travel guide', 'europe tourism', 'where to visit in europe', 'italy travel', 'EUROPE 2025', 'PLACES EUROPE 2025', 'Where to visit in Europe', 'Europe', 'Best places to visit in Europe', 'Europe 4K', 'Places Europe', 'Most beautiful places Europe', 'Europe places', 'What to see in Europe', 'Travel Europe', 'Most beautiful places in Europe', 'Things to do in Europe', 'Visit Europe', 'Europe trip', 'European countries', 'Europe documentary', 'Best places in Europe', '50 europe', 'top 50 europe', '50 places europe']",1071017,6688,290
tMJrQRJFNoA,Islands in the Stream - Music Travel Love &amp; Marsha Milan,"Thanks for watching our cover of ""Islands In The Stream"" filmed in beautiful Palau Kamapunian Besar, Kuala Penyu, Sabah, ...",2024-06-05T00:00:03Z,Music Travel Love,10,"['musictravellove', 'mtl', 'islands in the stream', 'islands in the stream cover', 'Marsha Milan', 'Live', 'Cover', 'lyrics', 'classic', 'music travel love islands in the stream', 'new music travel love', 'new mtl music', 'The Bee Gees islands in the stream', 'Dolly Parton kenny rogers islands in the stream']",19599900,96578,2790
HDDpg-WGUn4,How to Spend 5 Days in AMALFI Coast | Travel Itinerary,"In this video, I'll be sharing my ultimate 5-day Amalfi Coast itinerary, filled with top tips and must-see spots to help you have an ...",2024-10-06T15:00:21Z,Exotic Vacation,19,"['amalfi coast travel guide', 'italy travel guide', 'amalfi coast vacation', 'italy travel video', 'amalficoast', 'amalfi coast itinerary', 'Positano', 'Sorrento', 'Spiaggia Grande', 'Capri', 'Amalfi & Atrani', 'Ravello', 'amalfi travel', 'amalfi coast', 'amalfi coast italy', 'amalfi travel guide', 'amalfi', 'capri', 'italy travel', 'amalfi tips', 'what to do in amalfi', 'what to do amalfi coast', 'amalfi itinerary', 'amalfi italy', 'amalfi coast drive', 'ravello', 'italy amalfi coast', 'sorrento italy food']",314992,3099,159
4ONfrkskNp4,Stand By Me - Music Travel Love (At Al Ain),"Get ""Stand By Me"": Smart URL: https://lnk.to/sbmmtl Spotify: https://spoti.fi/3LNmXoq iTunes: https://apple.co/44m1pGE Amazon: ...",2023-05-03T00:00:10Z,Music Travel Love,10,"['Stand By Me', 'Music Travel Love', 'Stand By Me Lyrics', 'Stand By Me Chords', 'Stand By Me Collaboration', 'Live', 'Cover', 'Endless Summer']",73240023,514247,11546
