video_id,title,description,published_at,channel,category_id,tags,view_count,like_count,comment_count
y0eJ-vzzEr8,"Warm October Jazz Music at Cozy Coffee Shop Ambience 🍂 Peaceful Fall Morning for Work,Stress Relief","Warm October Jazz Music at Cozy Coffee Shop Ambience Peaceful Fall Morning for Work,Stress Relief Welcome to the ...",2025-10-01T10:21:13Z,Cozy Coffee Shop,10,"['tranquil october jazz', 'peaceful fall jazz', 'autumn coffee shop ambience', 'cozy fall jazz music', 'october morning jazz', 'relaxing piano jazz', 'smooth autumn jazz playlist', 'cozy cafe ambience', 'relaxing jazz background music', 'autumn morning ambience', 'peaceful coffee shop jazz', 'soft october jazz', 'cozy fall coffee shop sounds', 'calming autumn jazz', 'relaxing autumn vibes', 'cozy coffee shop', 'cafe jazz', 'jazz music', 'coffee shop ambience', 'cozy jazz music', 'fall morning jazz', 'jazz 2025']",3077,1314,0
htk6MRjmcnQ,Huntrix - Golden (Lyrics) KPop Demon Hunters,Subscribe to 7clouds K-Pop channel: https://www.youtube.com/@UCAEHrhfV8zfLcl0XsE2kVVw Huntrix - Golden (Lyrics) KPop ...,2025-07-01T12:55:22Z,7clouds,10,"['golden', 'golden lyrics', 'lyrics golden', 'huntrix', 'lyrics', 'huntrix golden', 'golden huntrix', 'huntrix golden lyrics', 'lyrics huntrix golden', 'huntrix lyrics', 'huntrix lyrics golden', 'golden lyrics huntrix', 'lyrics golden huntrix', 'golden huntrix lyrics', 'kpop demon hunters', 'kpop demon hunters lyrics', 'kpop demon hunters soundtrack', 'audrey nuna', 'rei ami', 'ejae', 'huntr/x', 'kpop', ""We're goin' up up up"", ""It's our moment"", 'Gonna be gonna bе golden', 'Yeong-wonhi kkaеjil su eobsneun', 'kpop demon hunters songs']",71366257,440421,17402
Efw37llM4zA,DJ MIX 2025 - Remixes &amp; Mashups of Popular Songs 2025 | DJ Remix Club Music Disco DJ Mix 2024,DJ MIX 2025 - Remixes & Mashups of Popular Songs 2025 | DJ Remix Club Music Disco DJ Mix 2024 | Real mixed and selected ...,2025-10-01T09:00:06Z,Valentino Sirolli,10,"['dj remix song', 'disco remix nonstop new songs', 'dj song', 'remix 2025', 'dj', 'dj remix', 'remix song', 'dj mix', 'remix', 'dj mix 2025', 'dj songs', 'dj 2025', 'remix dj song', 'dance music', 'club music', 'mix', 'dj music', 'dj remix 2025', 'remix songs', 'club mix 2025', 'mix 2025', 'songs', 'disco 2025', 'dj song remix', 'english dj song', '2025 dj', 'new dj song', 'mix songs', 'disco', 'club mix', 'disco remix', 'party songs', 'disco music', 'remix dj', 'music new songs', 'club songs', 'party music', 'club remix', 'valentino sirolli']",7502,1614,108
fTKqtvXjkvo,Top Hits 2025 ~ Summer Playlist 2025 ~ Top Songs 2025 Trending Music 🎶🎧,"Welcome to your ultimate summer soundtrack. This summer playlist is packed with the top hits 2025, blending the biggest ...",2025-06-27T18:54:01Z,Revive Music,10,"['top hits', 'top songs', 'summer playlist', 'summer mix', 'top hits playlist', 'top hits 2025', 'music mix', 'pop songs', 'billboard hot 100', 'billboard top 50 this week', 'top 40 songs this week', 'best pop songs', 'top music', 'top 50 songs of the week', 'new songs', 'pop hits', 'new music', 'billboard 2025', 'top 100 songs', 'pop music', 'billboard top 100', 'road trip playlist', 'road trip music', 'road trip pov with music', 'car pov with music', 'driving pov with music']",11258306,30372,2031
T_KA5KdyyH0,"20 Ca Khúc Hay Nhất MÂY LANG THANG 2024 | Phan Mạnh Quỳnh, Vũ, Văn Mai Hương, Lâm Bảo Ngọc,.. Live","20 Ca Khúc Hay Nhất MÂY LANG THANG 2024 | Phan Mạnh Quỳnh, Vũ, Văn Mai Hương, Lâm Bảo Ngọc, Quốc Thiên, Chu Thúy ...",2025-06-15T11:00:53Z,Mây Lang Thang Music,22,"['20 Ca Khúc Hay Nhất MÂY LANG THANG 2024', 'Phan Mạnh Quỳnh', 'Vũ', 'Văn Mai Hương', 'Lâm Bảo Ngọc', 'quốc thiên', 'chu thúy quỳnh', 'thúy anh', 'lê hiếu', 'hiền thục', 'phạm hồng phước', 'phan mạnh quỳnh live', 'vũ live', 'văn mai hương live', 'lâm bảo ngọc live', 'quốc thiên live', 'chu thúy quỳnh live', 'thúy anh live', 'lê hiếu live', 'phan manh quynh', 'vu.', 'van mai huong', 'lam bao ngoc', 'quoc thien', 'chu thuy quynh', 'mây lang thang', 'nhạc trẻ', 'nhạc ballad', 'playlist nhạc trẻ hay nhất', 'may lang thang']",2296150,5228,258
V9PVRfjEBTI,Billie Eilish - BIRDS OF A FEATHER (Official Music Video),Listen to HIT ME HARD AND SOFT: https://billieeilish.lnk.to/HITMEHARDANDSOFT Download BIRDS OF A FEATHER Live from ...,2024-09-27T15:00:38Z,BillieEilishVEVO,10,"['Billie Eilish', 'Darkroom/Interscope Records', 'Alternative']",570272530,4392422,119502
xGaZBfJOyAc,Lady Gaga - The Dead Dance (Official Music Video),"DO THE DEAD DANCE https://LadyGaga.lnk.to/TheDeadDance Directed by: Tim Burton Executive Produced by: Lady Gaga, ...",2025-09-03T16:00:07Z,LadyGagaVEVO,10,"['Lady Gaga', 'Interscope Records', 'Pop']",34582074,989226,61566
3iAiWIytqdw,Forever Young - Music Travel Love ft. Bugoy Drilon,"Get ""Forever Young"": Smart URL: https://lnk.to/5oxrLPPd Spotify: https://spoti.fi/4j3wJki iTunes: https://bit.ly/3RPNWSd Amazon: ...",2025-04-16T00:00:08Z,Music Travel Love,10,"['Music Travel Love', 'musictravellove', 'Forever Young', 'Forever Young Cover', 'Bugoy Drilon', 'Whang-od', 'MTL', 'Lyrics', 'Live', 'Cover', 'Philippines', 'Classic 80s Music', 'Forever Young Alphaville Cover', '80s Songs']",16402599,124735,4244
hK7E_E184js,Relaxing Heart Sutra Music for Meditation &amp; Sleep / 深く眠れる般若心経MUSIC [10-minute Zen Meditation],"Heart Sutra (般若心経) MUSIC – Modern Buddhist Chant for Deep Meditation Relaxing Zen Music for Sleep, Meditation, and Inner ...",2025-10-01T14:00:06Z,Kanho Yakushiji / 薬師寺寛邦 – Japanese Zen Music,10,"['meditation', 'japanesezenmusic', 'kanhoyakushiji', 'heartsutra', 'zen', 'buddhism', 'healing', '薬師寺寛邦', '药师寺宽邦', '藥師寺寬邦', '大悲呪', '大悲咒', 'NilakanthaDharani', '般若心経', '般若心經', '仏教', '日本', '京都', '僧侶', 'mindfulness', 'MeditationMusic', 'relaxing', 'Relax', 'HealingMusic', 'Mind', 'Soul', 'ZeeMusicCompany', 'ShekharRavjiani', 'mantra', 'Meditation', 'heal']",166,29,7
dssTSNwCH24,Ibiza Summer Mix 2025 🍓 Best Of Tropical Deep House Music Chill Out Mix 2024 🍓 Chillout Lounge,Ibiza Summer Mix 2025 Best Of Tropical Deep House Music Chill Out Mix 2024 Chillout Lounge Stream/Download: ...,2025-09-30T09:42:37Z,Magic Club,10,[],16023,3556,2
jpZC476jE7c,"Jahman X-press - ARVA feat. Souleymane Faye, Soda Mama &amp; Kine Lam (clip officiel)",Crédits de la chanson et du clip : Auteur : Jahman X-press Production : OPTIQUE STUDIOS Directed by : IBRAHIMA MBENGUE ...,2025-08-27T22:00:07Z,Jahman X-Press,10,"['Jahman Xpress', 'Damalay beugg', 'Diaman', 'Eternelle', 'Jantu mbeuguel', 'Wally Seck', 'Vj', 'Mia Guisse', 'Tarba Mbaye', 'Titi', 'Djelykaba Binetou', 'Ngaaka Blinde', 'Ngalam', 'Matadi', 'King Baba', 'Sidy Diop', 'Série Baabel', 'Saison 2', 'Marodi Tv', 'EvenProd', 'BÉTÉ BÉTÉ', 'Confidences', 'Lutte Tv', 'Fatou Ndiaye', 'Bass Thioung', 'Dip Doundou Guiss', 'Damlay Beugue', 'Safary', 'Amira Abed', 'Jeeba', 'Série sénégalaise', 'magal 2025', 'Eumeu Sene', 'Franc', 'Fatou Sangare', 'Arva', 'Amadeus']",15668478,176283,8908
ueNY30Cs8Lk,"Betsy, Мария Янковская – Sigma Boy (Official Music Video)","Качай BLACK RUSSIA на Android или IOS, вводи промокод #sigma Играй с нами на сервере PODOLSK и получай крутые ...",2025-04-24T15:00:06Z,Бэтси Girl,10,"['sigma boy', 'сигма бой', 'сигма бой клип', 'музыка', 'клип сигма бой', 'sigma boy song', 'betsy', 'sigma sigma boy', 'sigma boy music video', 'сигма boy', 'песня сигма бой', 'клип сигма boy', 'sigma', 'sigma boy original', 'бетси', 'крутые песни', 'sigma boy клип', 'sigma boy clip', 'sigma boy betsy', 'мария янковская', 'сигма', 'клип sigma boy', 'sigma boy video', 'si̇gma boy', 'клип на сигма бой', 'сигма сигма бой', 'betsy sigma boy', 'sigma boy official video', 'sigma sigma boy sigma boy sigma boy', 'сигма бой блек раша']",180335750,649909,23960
ktraqLnrurk,Music Mix 2025 #104 Party Club Dance 2025 | Best Remixes Of Popular Songs 2025 MEGAMIX (DJ Silviu M),"Party Club Mix 2025 #104 Music Dance Mix 2025 | Best Remixes Of Popular Songs 2025 MEGAMIX by DJ Silviu M ⚡ Guys, ...",2025-09-30T17:01:44Z,Dj Silviu M Official,10,"['party club', 'club mega party', 'dj silviu m', 'party club 2025', 'mega party 2025', 'Party 2025', 'best music mix 2025', 'party dance 2025', 'dance music 2025', 'dj silviu m 2025', 'club 2025 music', 'music remixes 2025', 'dance party 2025', 'club music mix 2025', 'Mix 2025', 'Music Mix 2025', 'Music 2025', 'remixes of popular', 'best music 2025', 'Popular Songs 2025', 'Best Remixes Of Popular Songs 2025', 'party 2025', 'music mix 2025', 'party mix 2025', 'megamix 2025', 'dj mix 2025', 'Year 2025 Mix', 'Club Mix 2025']",23965,221,18
byxFUKxhT3s,Alex Warren - Ordinary (Lyrics),Follow the official 7clouds playlist on Spotify : http://spoti.fi/2SJsUcZ ​   Alex Warren - Ordinary (Lyrics) ⏬ Download / Stream: ...,2025-04-30T13:17:52Z,7clouds,10,"['ordinary', 'ordinary lyrics', 'lyrics ordinary', 'alex warren', 'lyrics', 'alex warren ordinary', 'ordinary alex warren', 'alex warren ordinary lyrics', 'lyrics alex warren ordinary', 'alex warren lyrics', 'lyrics alex warren', 'alex warren lyrics ordinary', 'lyrics ordinary alex warren', 'ordinary alex warren lyrics', ""You're takin' me out of the ordinary"", ""I want you layin' me down 'til we're dead and buried"", ""On the edge of your knife stayin' drunk on your vine"", ""Somethin' so out of the ordinary"", 'pop', 'music']",53022546,275626,10579
8of5w7RgcTc,Afusic - Pal Pal (Official Music Video) Prod. @AliSoomroMusic,Listen Now On Spotify - https://open.spotify.com/track/4LMlVCXHJtCE9abhmn0mYo?si=ec8a6d106a054b63 If you've ever ...,2025-02-18T06:00:03Z,AFUSIC,10,"['punjabi trap', 'punjabi hip hop', 'new punjabi song 2025', 'latest punjabi song', 'sad punjabi song', 'energetic punjabi song', 'deep punjabi song', 'trap beats punjabi', 'urban punjabi music', 'toronto punjabi rap', 'desi hip hop', 'brown boy music', 'punjabi drill', 'emotional punjabi rap', 'viral\xa0punjabi\xa0song', 'trending punjabi song', 'viral punjabi track', 'tiktok viral song', 'reels viral song', 'Instagram trending song', 'Punjabi sad drill', 'YouTube trending music', 'punjabi trap remix', 'club vibes Punjabi']",299925565,2606331,83237
JWLWczFtCag,BLOK3 - GİT (Official Music Video),"BLOK3 'ün Virtüöz EP 'sinden "" GİT '' isimli parçası video klibi ile birlikte Mundo Music etiketiyle şimdi tüm dijital platformlarda ...",2025-07-17T21:00:06Z,Blok3,10,"['blok', 'blok 3', 'üç', 'virtüöz ep', 'blok virtüöz', 'hakan', 'aydın', 'hakan aydın', 'hako', 'hako virtüöz', 'müzik', 'mundo', 'mundo music', 'mundo müzik', 'music', 'git peşimi bırak', 'senin aşkın bana bi tuzak', 'git', 'blok 3 git', 'blok3 git', 'hako git', 'bi kez olsun kendine yakışanı yap', 'fotoğramızı sakla', 'beni soran olursa', 'düzelettin beni', 'kafamın içinde', 'bıraktın beni', 'neden neden neden neden', 'kuşkulanırdım', 'hevesi kaçar da benden gider mi diye']",79639234,377188,15597
wYxoIzHU7is,Love Songs and Romantic Songs ~ Beautiful Love Songs 80s 90s 💕 Best Love Songs of All Time,Love Songs and Romantic Songs ~ Beautiful Love Songs 80s 90s Best Love Songs of All Time Love Songs and Romantic ...,2025-07-12T21:00:54Z,Open Your Arms,10,"['love song', 'love songs', 'best romantic love songs', 'love songs playlist', 'english love songs', 'romantic love songs', 'old love songs', 'lovesong', 'love song forever', 'greatest beautiful love songs', 'new love songs', '90s love songs', 'love songs 80s 90s', 'love songs of all time', 'love songs romantic', 'greatest love songs', 'best love songs of all time', 'love songs greatest hits playlist', 'chill songs', 'falling in love', 'best old songs', 'english song', 'romantic songs', 'old songs', 'classic songs']",1652147,5431,165
Ug_pv5-r1js,“What It Sounds Like” Song Clip | KPop Demon Hunters | Netflix Family,"Rumi, Zoey, and Mira reunite on stage to fight Gwi-Ma and his demon army while singing the song they couldn't write. Sing along ...",2025-07-10T13:00:05Z,Netflix Family,24,"['KPop Demon Hunters', 'KPop Demon Hunters clips', 'KPop Demon Hunters film', 'KPop Demon Hunters movie', 'KPop Demon Hunters music', 'KPop Demon Hunters netflix', 'KPop Demon Hunters songs', 'KPop Demon Hunters soundtrack', 'KPop Demon Hunters twice', 'KPop movie twice', 'Netflix', 'Netflix 2025', 'Netflix Original Series', 'Netflix YA', 'Netflix kids', 'films now on Netflix 2025', 'huntrix', 'kpop movie netflix', 'new on Netflix', 'what it sounds like song clip']",177003629,871823,0
rV4iG4nn5Iw,Nati Ker - Neger Neger | ነገር ነገር - New Ethiopian Music 2025 (Official Video),Nati Ker - Neger Neger | ነገር ነገር - New Ethiopian Music 2025 (Official Video) Subscribe to Nati Ker | And Turn ON ...,2025-08-22T15:01:29Z,Nati Ker,24,"['Veronica Adane', 'Michel Belayineh', 'Abdu Kiar', 'Ayizon', 'New Album', 'New Ethiopian Music 2025', 'Ethiopian Music 2025', 'Ethiopian Music', 'Amharic Music', 'Andualem Gosa', 'Same', 'Nati Ker', 'Niku', 'Bilillee', 'Guragigna Music', 'Guragigna', 'New Ethiopian Music', 'Teddy afro', 'Leul Sisay', 'Dawit Tsige', 'ELLA RECORDS', 'Nahom Records Inc', 'Hope Music Ethiopia', 'New Amharic Music 2025', 'Kuku Sebsibe', 'Seifu ON EBS', 'Mahlet Wendimu', 'Yared Negu', 'Yohana', 'Nahom Records', 'Teddy Yo', 'Mesay Tefera', 'Neger Neger']",2496707,34903,3282
8O-1qB-fxjc,Chill Songs Vol.02 | Cozy &amp; Relaxing Music for a Peaceful Day,Mocktail Music Channel ================================================== Chill Songs Vol.02 | Cozy & Relaxing ...,2025-03-03T00:00:05Z,MocktailMusic,10,"['ChillMusic', 'RelaxingMusic', 'LongPlay', 'LoFiBeats', 'IndieMusic', 'AcousticVibes', 'JazzMusic', 'RNB', 'SoulMusic', 'FolkMusic', 'PopMusic', 'WorkMusic', 'StudyMusic', 'CafeVibes', 'RainyDayMusic', 'BackgroundMusic', 'SoftMusic', 'CalmVibes', 'CoffeeShopMusic', 'DeepFocus', 'InstrumentalBeats', 'EasyListening', 'PeacefulVibes', 'SmoothJazz', 'SlowJam', 'BedroomMusic', 'SundayVibes', 'FeelGoodMusic', 'AestheticMusic', 'MorningVibes', 'NightVibes', 'BestChillSongs', 'SoftVibes', 'RelaxAndUnwind', 'LoFiChill', 'CozyCafe', 'MusicForWork', 'StudyBeats', 'ChillPlaylist', 'MellowVibes', 'JazzLounge', 'chillsong']",6853783,42672,2547
z-qigE1ym40,"Beautiful Relaxing Music - Stop Overthinking, Stress Relief Music, Sleep Music, Calming Music #242","Beautiful Relaxing Music - Stop Overthinking, Stress Relief Music, Sleep Music, Calming Music #242 Bask in these exquisite ...",2024-09-28T07:49:43Z,Inner Peace Look Inside,10,"['inner peace', 'piano relaxing music', 'Sleep Music', 'Stress Relief', 'BGM', 'relaxing sleep music', 'relax', 'relaxation', 'meditation music', 'reep sleeping music', 'Relaxing Piano', 'study music', 'peaceful music', 'calm music', 'soothing music', 'calming music', 'meditation', 'piano music', 'background music', 'stress relief music', 'piano', 'soothing relaxation', 'sleeping', 'healing music', 'sleep music', 'relaxing music', 'deep sleep music', 'sleeping music', 'stop overthinking', 'Stress Relief Music', 'beautiful relaxing music']",10418121,70579,2652
iTB3mCIBWMA,Morning Vibes Playlist ☕ Feel Good Music to Lift Your Mood,Begin your day with music that flows like a gentle river A chillout mix to bring lightness and ease to your morning Subscribe ...,2025-01-07T08:00:36Z,We Are Diamond,10,"['deep house', 'deep', 'house', 'music', 'dance', 'edm', 'Chillout', 'Chill Mix', 'Chillout Summer Mix', 'We Are Diamond', 'Chill', 'Relaxing', 'Chill Out', 'Deep House', 'chill-out music', 'chill house', 'chillout', 'chill', 'morning music', 'morning']",12293851,60042,906
3lZYvVRCWO0,𝗽𝗹𝗮𝘆𝗹𝗶𝘀𝘁🎧 틀어놓기만 해도 분위기를 채워주는 잔잔한 플레이리스트 | Chill &amp; Mood,"작업할 때, 공부할 때 , 뒹굴거릴 때, 일단 틀어놓으면 분위기는 책임질게요 조용한데 심심하진 않은, 잔잔한데 꽤 감성 터지는 음악 ...",2025-07-12T01:30:02Z,Breeze Mood,10,[],1467995,11570,168
-YlmnPh-6rE,For A Reason (Official Video) Karan Aujla | Tania  | Ikky | Latest Punjabi Songs 2025,Sandeep Rehaan & Karan Aujla Present Song - For A Reason Singer/Lyrics/Composer - Karan Aujla Music - Ikky Directed By: ...,2025-08-22T08:30:05Z,Rehaan Records,10,"['Karan Aujla', 'For A Reason', 'PPOP Culture', 'Karan Aujla Official Video', 'Punjabi songs', 'Punjabi rap', 'latest Punjabi songs', 'Indian hip hop', 'Karan Aujla album', 'new Punjabi music', 'For A Reason Karan Aujla', 'PPOP Culture album', 'Punjabi hits', 'Karan Aujla new song', 'Punjabi music video', 'Karan Aujla PPOP Culture', 'daytona', 'I Really Do...', ""You're U Tho"", 'Boyfriend', 'HIM.', ""Flip-Side (Sandy's Interlude)"", ""I'ma Do My Thiiing"", 'Daytona', '7.7 Magnitude', 'MF Gabhru!', 'P-POP CULTURE']",85200761,860268,15758
CIvjOVFCOig,"PAMPATULOG | ROMANTIC LOVE SONGS | COMPILATION | NON STOP MUSIC | LOVE SONGS 70s, 80s &amp; 90s","PAMPATULOG | ROMANTIC LOVE SONGS | COMPILATION | NON STOP MUSIC | LOVE SONGS 70s, 80s & 90s ------ ""Hello ...",2025-04-28T22:00:19Z,Classic Medley,22,"['PAMPATULOG', 'ROMANTIC LOVE SONGS', 'NON STOP MUSIC', 'LOVE SONGS 70s 80s 90s', 'beautiful opm love songs', 'romantic love songs', 'best romantic love songs', 'love music', 'love songs lyrics', 'best old songs', 'classic love songs medley', 'opm nonstop love songs', 'classic love songs', 'tagalog love songs']",4566682,16435,387
u9Dg-g7t2l4,Disturbed  - The Sound Of Silence (Official Music Video) [4K UPGRADE],New album Divisive out now: https://Disturbed.lnk.to/Divisive Subscribe to the channel: ...,2015-12-08T15:28:55Z,Disturbed,10,"['disturbed', 'sound of silence', 'simon and garfunkel cover', 'david draiman', 'disturbed immortalized', 'the sound of silence cover', 'hello darkess my old friend', 'disturbed singing the sound of silence', 'disturbed the sound of silence original', 'disturbed covers', 'disturbed songs', 'disturbed official video', 'the sound of silence disturbed', 'warner records']",1126733660,6756807,263038
VTbo8E8es9A,Mbosso - Pawa (Official Music Video),"Music video by Mbosso performing, “Pawa” (Power), is a heartfelt, poetic love song by Mbosso that captures the overwhelming ...",2025-06-19T15:00:06Z,Mbosso,10,"['mbosso', 'watakubali', 'shida', 'nimekuzoea', 'alele', 'nadekezwa', 'zilipendwa', 'kwangwaru', 'wasafi', 'harmonize', 'rayvanny', 'iyena', 'gundu', 'sikomi', 'nipepee', 'jibebe', 'konki', 'nyegezi', 'hodari', 'tetema', 'tamu', 'kainama', 'diamond platnumz', 'lava lava', 'zima feni', 'ashua', 'amaboko', 'yope remix', 'haijakaa sawa', 'tamba', 'magufuli', 'ccm', 'pawa', 'Alikiba', 'Trending Music']",36888056,227913,10538
Oa_RSwwpPaA,Benson Boone - Beautiful Things (Official Music Video),Benson Boone - Beautiful Things (Official Music Video) 'American Heart' the second album from Benson Boone – out now: ...,2024-01-18T23:00:13Z,Benson Boone,10,"['Benson Boone', 'Beautiful Things', 'Benson Boone Beautiful Things', 'Benson Boone Beautiful Things Music Video', 'Benson Boone lyrics', 'Beautiful Things lyrics', 'Benson Boone Beautiful Things lyrics', 'In The Stars', 'Benson Boone In The Stars', 'benson boone', 'benson', 'benson boone in the stars', 'benson boone new music', 'benson boone live', 'in the stars lyrics', 'new music', 'music shorts', 'benson boone new song', 'benson boone music video', 'benson beautiful', 'these beautiful things', 'benson boone lyrics']",804971608,5789120,123688
fLexgOxsZu0,Bruno Mars - The Lazy Song (Official Music Video),"The official music video for Bruno Mars' ""The Lazy Song"" from the album 'Doo-Wops and Hooligans''. Stream: ...",2011-04-15T22:08:07Z,Bruno Mars,10,"['bruno mars', 'lazy song', 'the lazy song', 'bruno mars lazy song', 'bruno mars the lazy song', 'bruno lazy song', 'bruno', 'doo wops and hooligans', 'pop music', 'atlantic records', 'official music video', 'bruno chimp video', 'Bruno Mars - The Lazy Song (Official Music Video)', 'poreotics', 'bruno mars monkey video', 'bruno mars monkey song', ""today i don't feel like doing anything"", 'i just wanna lay in my bed', 'bruno mars chimp song', 'summer songs', 'happy songs', 'lazy song video', 'the lazy song video']",3087923020,16148289,669265
VZgjM6kTUTk,Ibiza Summer Mix 2025 🍓 Best Of Tropical Deep House Music Chill Out Mix 2024 🍓 Chillout Lounge,Ibiza Summer Mix 2025 Best Of Tropical Deep House Music Chill Out Mix 2024 Chillout Lounge Stream/Download: ...,2025-10-01T10:03:11Z,Magic Club,10,[],3392,2172,0
7CGKeID7nRc,GIMS &amp; La Mano 1.9 - PARISIENNE (Clip officiel),GIMS & La Mano 1.9 - PARISIENNE (Clip officiel) PARISIENNE disponible en streaming : https://bfan.link/parisienne-1 Abonne-toi ...,2025-08-16T14:00:15Z,GIMS,10,"['maitre gims', 'LDVM', 'gims LDVM', 'maitre gims 2022', 'maitre gims 2023', 'gims 2022', 'gims 2023', 'maitre gims album', 'gims album', 'Maitre gims LDVM']",23657942,203736,6929
N6O2ncUKvlg,Nelly - Just A Dream (Official Music Video),REMASTERED IN HD! UP TO 4K!! Official Music Video for Just A Dream performed by Nelly. Listen to the Best Of playlist from ...,2010-09-21T20:21:14Z,NellyVEVO,10,"['just dream nelly', 'nelly just dream official video', 'nelly just dream video', 'nelly videos', 'nelly youtube channel', 'nelly 5.0', 'nelly rapper', 'nelly rapper hit songs', 'nelly songs', 'nelly 5.0 songs', 'nelly justa dream', 'NELLY JUST DREAM', 'JUST DREAM', 'JUST DREAM official music video', 'JUST DREAM remastered video', 'NELLY remastered', 'NELLY remastered videos', '#remastered', 'hd music videos', 'remastered music videos']",929082981,4042364,158480
H_lCo82ekbg,水曜コーヒー【作業用BGM】🎃 Cozy Piano Background Music for Pumpkin Season in a Lakeside Autumn Town,Embrace the cozy charm of pumpkin season with gentle piano sounds from a lakeside town in full autumn bloom. Ideal for quiet ...,2025-09-30T15:00:19Z,BGM channel,10,"['水曜コーヒー', '作業用BGM', 'BGM', '音楽', 'bgm channel', '勉強用BGM', '集中', 'カフェBGM', 'cafe music', 'jazz', 'bossa nova', 'piano', 'coffee', 'background music', 'instrumental music', 'light blue truck', 'autumn', 'lakeside', 'pumpkin', 'cozy', 'work music', 'study music', 'focus music', 'relaxing music', 'calm music', 'healing music', 'BGM作業用', '音楽 カフェ', '勉強 音楽', '集中 BGM', 'BGM 勉強', 'BGM 集中', 'Wednesday', '水曜日', '秋の月カフェ', 'música para estudiar', 'música para trabalhar', 'BGM 업무용', '공부할때 듣는 음악', 'musique pour étudier']",28964,106,0
FDkXWJWp4WM,"Smooth Jazz Background Music for Relaxing, Working 🍂 Fall Cafe Ambience with Warm Piano Jazz Music","Smooth Jazz Background Music for Relaxing, Working Fall Cafe Ambience with Warm Piano Jazz Music 👉️   Let's ...",2025-09-30T17:16:43Z,Relax Jazz Cafe,22,"['jazz', 'jazz music', 'smooth jazz', 'background music', 'background jazz', 'fall jazz', 'autumn jazz', 'warm jazz', 'piano jazz', 'jazz piano', 'cafe jazz', 'jazz cafe', 'jazz for relaxing', 'jazz for work', 'cafe ambience', 'fall cafe', 'fall cafe ambience', 'smooth jazz music', 'jazz background music', 'fall jazz music', 'autumn jazz music', 'warm jazz music', 'piano jazz music', 'cafe jazz music', 'jazz cafe music', 'smooth fall jazz', 'warm fall jazz', 'autumn ambience', 'fall ambience', 'relax jazz cafe', 'cafe music']",26203,2082,8
pMOblGlvFuY,AURA = ♾️ | 1 HOUR VIRAL AURA MUSIC PLAYLIST 2025 🔥 TRENDING PHONK HITS,AURA = ♾️ | 1 HOUR VIRAL AURA MUSIC PLAYLIST 2025 TRENDING PHONK HITS WELCOME TO EMPIRE PHONK ...,2025-09-29T09:15:05Z,EMPIRE PHONK,10,"['empire phonk', 'phonk', 'phonk music', 'phonk songs', 'brazilian phonk', 'gym songs', 'aura song', 'aura', 'phonk song', 'phonk brazilian', 'aura phonk']",448895,5790,398
SDd3AyocuxU,100%heartattack#heartattack #cover #singer #music #song,,2025-06-16T01:35:01Z,ViralVarietyVault,22,[],5749047,199330,1516
ArOS-e2d-cM,Music Box of Fate - Ironmouse Original Opera Song,Music Box of Fate - Ironmouse Original Opera Song Vocals by Ironmouse https://x.com/ironmouse Animation and Direction by ...,2025-07-25T17:00:14Z,ironmouse,24,"['Ironmouse', 'VTuber']",852036,82794,5414
f-i_nJLG2Is,"Relaxing Guitar for Stress Relief, work and study | REMEMBERED",Press play. Close your eyes and wander through memories. Subscribe to the Channel: ...,2025-05-13T03:00:44Z,REMEMBERED,10,"['acoustic guitar', 'guitar music', 'disney acoustic guitar', 'relaxing guitar music', 'acoustic guitar songs', 'guitar acoustic songs', 'guitar', 'acoustic', 'spanish guitar', 'romantic guitar', 'acoustic guitars', 'acoustic songs', 'acoustic cover', 'relaxing acoustic guitar', 'solo acoustic guitar music', 'disney acoustic guitar collection', 'acoustic guitar music for sleeping', 'acoustic guitar music for studying', 'acoustic guitar instrumental music', 'relaxing guitar']",1943008,16199,645
VHV8xYK7esY,December Avenue - Saksi Ang Langit | LYRICS,December Avenue - Saksi Ang Langit” Lyrics / Lyric Video by Lyrics Republic Turn on notifications to stay updated with new ...,2025-09-02T00:00:27Z,Lyrics Republic,22,"['saksi ang langit', 'december', 'avenue', 'december avenue', 'lyrics', 'saksi ang langit lyrics', 'opm', '2025', 'trending', 'viral']",2477173,4175,254
